{
    "contract_version": "1.0.0",
    "case_id": "case:matching/atomic-literal-rewrite",
    "specification_version": "1.0-draft.1",
    "title": "Atomic literal elision preserves behavior",
    "authorship": {
        "kind": "specification_authored",
        "intent_source": "spec/drafts/1.0/README.md"
    },
    "input": {
        "kind": "semantic",
        "program": {
            "contract_version": "1.0.0",
            "specification_version": "1.0-draft.1",
            "normalization": "canonical-v1",
            "case_matching": "sensitive",
            "root": {
                "node_id": "node:case.atomic-literal",
                "kind": "atomic",
                "body": {
                    "node_id": "node:case.atomic-literal.body",
                    "kind": "literal",
                    "text": "ab"
                }
            }
        }
    },
    "expectations": {
        "semantic": {
            "exact_program": {
                "contract_version": "1.0.0",
                "specification_version": "1.0-draft.1",
                "normalization": "canonical-v1",
                "case_matching": "sensitive",
                "root": {
                    "node_id": "node:case.atomic-literal",
                    "kind": "atomic",
                    "body": {
                        "node_id": "node:case.atomic-literal.body",
                        "kind": "literal",
                        "text": "ab"
                    }
                }
            }
        },
        "matches": {
            "operation": "full_match",
            "positive": [
                {
                    "match_id": "literal",
                    "subject": "ab",
                    "captures": []
                }
            ],
            "negative": [
                {
                    "match_id": "different",
                    "subject": "ac"
                }
            ]
        },
        "targets": [
            {
                "target_profile": {
                    "profile_id": "profile:ecmascript/2024",
                    "profile_version": "1.2.0",
                    "sha256": "5b012d7b0536610d4496718e6954c8f9ec80c16dde26a18f70663d0275ec333e"
                },
                "status": "equivalent_rewrite",
                "reason_codes": ["equivalence_proof_certified"]
            },
            {
                "target_profile": {
                    "profile_id": "profile:pcre2/10.42",
                    "profile_version": "1.2.0",
                    "sha256": "15e9032404dd934ca060e82fbe47f2af5f0b84a4daf1037c3d607a6ef1c4d051"
                },
                "status": "native"
            },
            {
                "target_profile": {
                    "profile_id": "profile:pcre2/10.43",
                    "profile_version": "1.2.0",
                    "sha256": "6b8a974a57d91698fb427e1c5525109deb4e7e481fcf07b79a35de716ccff979"
                },
                "status": "native"
            },
            {
                "target_profile": {
                    "profile_id": "profile:python-re/3.11",
                    "profile_version": "1.3.0",
                    "sha256": "5808a05beb86acf1577ab4b10055c65c0ee81eb7a167e1f6762c421e7043b751"
                },
                "status": "native"
            },
            {
                "target_profile": {
                    "profile_id": "profile:python-re/3.11-bytes",
                    "profile_version": "1.1.0",
                    "sha256": "0ecba94d8083bf26d97f518aca94c6f2b9e4bbff7f0d0eb960c1fb6317c5fcfa"
                },
                "status": "native"
            }
        ]
    },
    "tags": ["atomic", "matching", "rewrite"]
}
