{
    "contract_version": "1.0.0",
    "case_id": "case:matching/negated-character-class",
    "specification_version": "1.0-draft.1",
    "title": "Outer character-set negation applies after member union",
    "authorship": {
        "kind": "specification_authored",
        "intent_source": "spec/drafts/1.0/README.md"
    },
    "input": {
        "kind": "semantic",
        "program": {
            "contract_version": "1.0.0",
            "specification_version": "1.0-draft.1",
            "normalization": "canonical-v1",
            "case_matching": "sensitive",
            "root": {
                "node_id": "node:case.negated-class",
                "kind": "character_set",
                "negated": true,
                "members": [
                    {
                        "kind": "literal",
                        "value": "x"
                    },
                    {
                        "kind": "range",
                        "start": "0",
                        "end": "9"
                    }
                ]
            }
        }
    },
    "expectations": {
        "semantic": {
            "exact_program": {
                "contract_version": "1.0.0",
                "specification_version": "1.0-draft.1",
                "normalization": "canonical-v1",
                "case_matching": "sensitive",
                "root": {
                    "node_id": "node:case.negated-class",
                    "kind": "character_set",
                    "negated": true,
                    "members": [
                        {
                            "kind": "literal",
                            "value": "x"
                        },
                        {
                            "kind": "range",
                            "start": "0",
                            "end": "9"
                        }
                    ]
                }
            }
        },
        "matches": {
            "operation": "full_match",
            "positive": [
                {
                    "match_id": "outside_union",
                    "subject": "a",
                    "captures": []
                }
            ],
            "negative": [
                {
                    "match_id": "literal_member",
                    "subject": "x"
                },
                {
                    "match_id": "range_member",
                    "subject": "5"
                }
            ]
        },
        "targets": [
            {
                "target_profile": {
                    "profile_id": "profile:ecmascript/2024",
                    "profile_version": "1.3.0",
                    "sha256": "d0f13d7b7b0af92f201dfd29270325d9c3cce50cf39a5969648b71c9c25905bc"
                },
                "status": "native"
            },
            {
                "target_profile": {
                    "profile_id": "profile:pcre2/10.42",
                    "profile_version": "1.3.0",
                    "sha256": "57941ab3f2a5709d030c6f890b1911564513e0dd785710956d7b8af19711e9e2"
                },
                "status": "native"
            },
            {
                "target_profile": {
                    "profile_id": "profile:pcre2/10.43",
                    "profile_version": "1.3.0",
                    "sha256": "56762a1d289d41d0811b007695464916fda0ca5c48c2f5569b4ec26983a24bff"
                },
                "status": "native"
            },
            {
                "target_profile": {
                    "profile_id": "profile:python-re/3.11",
                    "profile_version": "1.4.0",
                    "sha256": "b3d5e5cbce0a2cd1f0f236914b7d35abc6e7c7614ff9d80d4ee2b7c546d5f3cf"
                },
                "status": "native"
            },
            {
                "target_profile": {
                    "profile_id": "profile:python-re/3.11-bytes",
                    "profile_version": "1.2.0",
                    "sha256": "385ed4271e999db85dd0d4c1fd2894c50b2eb16e0d40a3c83b0306fb7fa1805c"
                },
                "status": "unsupported",
                "reason_codes": ["profile_capability_unavailable"]
            }
        ]
    },
    "tags": ["character_class", "interaction", "matching", "negation"]
}
