{
    "contract_version": "1.0.0",
    "case_id": "case:matching/unicode-digit-class",
    "specification_version": "1.0-draft.1",
    "title": "Unicode digit class uses Unicode character semantics",
    "authorship": {
        "kind": "specification_authored",
        "intent_source": "spec/drafts/1.0/README.md"
    },
    "input": {
        "kind": "semantic",
        "program": {
            "contract_version": "1.0.0",
            "specification_version": "1.0-draft.1",
            "normalization": "canonical-v1",
            "case_matching": "sensitive",
            "root": {
                "node_id": "node:case.unicode-digit",
                "kind": "character_set",
                "negated": false,
                "members": [
                    {
                        "kind": "builtin",
                        "name": "digit",
                        "domain": "unicode",
                        "negated": false
                    }
                ]
            }
        }
    },
    "expectations": {
        "semantic": {
            "exact_program": {
                "contract_version": "1.0.0",
                "specification_version": "1.0-draft.1",
                "normalization": "canonical-v1",
                "case_matching": "sensitive",
                "root": {
                    "node_id": "node:case.unicode-digit",
                    "kind": "character_set",
                    "negated": false,
                    "members": [
                        {
                            "kind": "builtin",
                            "name": "digit",
                            "domain": "unicode",
                            "negated": false
                        }
                    ]
                }
            }
        },
        "matches": {
            "operation": "full_match",
            "positive": [
                {
                    "match_id": "arabic_indic",
                    "subject": "٣",
                    "captures": []
                },
                {
                    "match_id": "ascii",
                    "subject": "7",
                    "captures": []
                }
            ],
            "negative": [
                {
                    "match_id": "letter",
                    "subject": "a"
                }
            ]
        },
        "targets": [
            {
                "target_profile": {
                    "profile_id": "profile:ecmascript/2024",
                    "profile_version": "1.1.0",
                    "sha256": "5117ff6e6c30da54eb31a4621dce5f4807ab0e95f183848e70a01731a4bb4c9f"
                },
                "status": "native"
            },
            {
                "target_profile": {
                    "profile_id": "profile:pcre2/10.42",
                    "profile_version": "1.1.0",
                    "sha256": "0204c9b8ac96ac04a73497ec9ef9f07a2b21728c9cf5f1ff580fa154b4c53a6d"
                },
                "status": "native"
            },
            {
                "target_profile": {
                    "profile_id": "profile:pcre2/10.43",
                    "profile_version": "1.1.0",
                    "sha256": "0a40fef0e89ab341a031f335438d42203d21fa438358ab9a4aa1177fb8b9bbb4"
                },
                "status": "native"
            },
            {
                "target_profile": {
                    "profile_id": "profile:python-re/3.11",
                    "profile_version": "1.2.0",
                    "sha256": "55e7f0bc93e2192d5f09f6c4ef65b6bff0dc831571059d80edf9b8b661f80a6c"
                },
                "status": "native"
            }
        ]
    },
    "tags": [
        "character_class",
        "matching",
        "unicode"
    ]
}
